product_name,category,description,target_market
Blephamed Eyelid Cleansing Foam,Eyelid and Eyelash Cleansers,"A specialized daily cleansing foam designed to remove environmental pollutants, makeup, and crusting from the eyelids and eyelashes without causing irritation to the sensitive ocular surface.","Individuals with sensitive eyes, contact lens wearers, and those prone to blepharitis."
Blephamed Sterile Eyelid Wipes,Eyelid and Eyelash Cleansers,Individually wrapped pre-moistened sterile wipes infused with soothing botanical extracts for the mechanical cleaning of eyelids in cases of inflammation or infection.,"Post-operative patients, travelers, and individuals suffering from chronic blepharitis or dry eye syndrome."
Blephamed Micellar Ocular Solution,Eyelid and Eyelash Cleansers,A gentle micellar water specifically formulated for the ocular area to trap oils and dirt while maintaining the natural lipid layer of the eye.,Daily makeup users and individuals living in high-pollution urban areas.
Blephamed Tea Tree Oil Gel,Therapeutic Eye Care,A high-viscosity gel containing standardized Tea Tree Oil concentrations specifically targeted at managing Demodex mite infestations on the eyelashes and eyebrows.,Patients diagnosed with Demodex blepharitis or chronic eyelid inflammation.
Blephamed Intensive Eyelid Soothing Cream,Therapeutic Eye Care,"A restorative cream designed to treat eczema, dermatitis, and extreme dryness on the eyelids, providing a protective barrier against external irritants.",Individuals with atopic dermatitis or allergic contact dermatitis affecting the eye area.
Blephamed Lubricating Eye Drops (Monodose),Dry Eye Management,"Preservative-free artificial tears designed to provide long-lasting relief from dryness, burning, and foreign body sensations in the eye.","Office workers with high screen time, elderly patients, and those in dry climates."
Blephamed Nighttime Ocular Ointment,Dry Eye Management,"A thick, lubricating ointment applied before sleep to provide an intensive moisture shield for the cornea during the night.",Patients with severe dry eye syndrome or lagophthalmos (incomplete eyelid closure).
Blephamed Thermal Eye Mask,Ocular Hygiene Accessories,"A reusable heat mask designed to deliver consistent warmth to the eyelids, helping to liquefy clogged oils in the Meibomian glands.",Patients with Meibomian Gland Dysfunction (MGD) and styes.
Blephamed Cooling Eye Patches,Ocular Hygiene Accessories,Hydrogel patches designed to reduce periorbital edema and provide relief after minor ocular procedures or long periods of eye strain.,"Post-cosmetic surgery patients and individuals with tired, puffy eyes."
Blephamed Kids Gentle Eyelid Cleanser,Specialized Pediatric Care,"An ultra-mild, 'no-tears' formulated cleanser specifically designed for the sensitive skin and eyes of children and infants.",Parents of infants with 'sticky eye' or children with pediatric blepharitis.
Blephamed Ocular Surface Analysis Service,Professional Diagnostic & Clinical Services,A comprehensive diagnostic consultation service using advanced imaging to assess tear film stability and Meibomian gland health.,Ophthalmology clinics and specialized dry eye centers.
Blephamed In-Clinic Eyelid Debridement,Professional Diagnostic & Clinical Services,A professional-grade mechanical cleaning service performed by specialists to remove biofilm and bacterial colonies from the lid margin.,Chronic blepharitis patients unresponsive to home care.
